{
  "fixture_version": "engine-fixture/v1",
  "id": "turn-structure/pending-raise-response-legality",
  "ruleset": "truco-2p-v1",
  "description": "When a raise is pending, only the response actions should be available to the other player.",
  "initial_state": {
    "dealer": 1,
    "next_player": 0,
    "score": {
      "0": 0,
      "1": 0
    },
    "hand_value": 1,
    "turnup": {
      "rank": "A",
      "suit": "SPADES"
    },
    "hands": {
      "0": [
        {
          "id": "p0c0",
          "rank": "7",
          "suit": "DIAMONDS"
        },
        {
          "id": "p0c1",
          "rank": "6",
          "suit": "CLUBS"
        },
        {
          "id": "p0c2",
          "rank": "4",
          "suit": "HEARTS"
        }
      ],
      "1": [
        {
          "id": "p1c0",
          "rank": "3",
          "suit": "CLUBS"
        },
        {
          "id": "p1c1",
          "rank": "5",
          "suit": "SPADES"
        },
        {
          "id": "p1c2",
          "rank": "4",
          "suit": "DIAMONDS"
        }
      ]
    },
    "completed_rounds": [],
    "current_round": {
      "leader": 0,
      "plays": [
        {
          "player": 0,
          "visibility": "up",
          "card": {
            "id": "p0c0",
            "rank": "7",
            "suit": "DIAMONDS"
          }
        }
      ]
    },
    "pending_raise": {
      "raised_by": 1,
      "to": 3,
      "previous_value": 1
    }
  },
  "steps": [
    {
      "op": "assert_legal_actions",
      "player": 0,
      "must_include": [
        {
          "type": "accept_raise"
        },
        {
          "type": "fold"
        },
        {
          "type": "raise",
          "to": 6
        }
      ],
      "must_exclude": [
        {
          "type": "play_face_up",
          "card_id": "p0c1"
        },
        {
          "type": "play_face_down",
          "card_id": "p0c1"
        }
      ]
    },
    {
      "op": "apply_action",
      "player": 0,
      "action": {
        "type": "accept_raise"
      }
    },
    {
      "op": "assert_state",
      "expect": {
        "next_player": 1,
        "hand_value": 3,
        "pending_raise": null,
        "completed_rounds": [],
        "current_round": {
          "leader": 0,
          "plays": [
            {
              "player": 0,
              "visibility": "up",
              "card": {
                "rank": "7",
                "suit": "DIAMONDS"
              }
            }
          ]
        }
      }
    }
  ]
}
