{
  "fixture_version": "engine-fixture/v1",
  "id": "card-ordering/stronger-non-manilha-beats-weaker",
  "ruleset": "truco-2p-v1",
  "description": "A stronger non-manilha beats a weaker non-manilha.",
  "initial_state": {
    "dealer": 1,
    "next_player": 0,
    "score": {
      "0": 0,
      "1": 0
    },
    "hand_value": 1,
    "turnup": {
      "rank": "5",
      "suit": "SPADES"
    },
    "hands": {
      "0": [
        {
          "id": "p0c0",
          "rank": "7",
          "suit": "DIAMONDS"
        },
        {
          "id": "p0c1",
          "rank": "4",
          "suit": "CLUBS"
        },
        {
          "id": "p0c2",
          "rank": "6",
          "suit": "HEARTS"
        }
      ],
      "1": [
        {
          "id": "p1c0",
          "rank": "6",
          "suit": "CLUBS"
        },
        {
          "id": "p1c1",
          "rank": "4",
          "suit": "SPADES"
        },
        {
          "id": "p1c2",
          "rank": "K",
          "suit": "DIAMONDS"
        }
      ]
    },
    "completed_rounds": [],
    "current_round": {
      "leader": 0,
      "plays": []
    },
    "pending_raise": null
  },
  "steps": [
    {
      "op": "apply_action",
      "player": 0,
      "action": {
        "type": "play_face_up",
        "card_id": "p0c0"
      }
    },
    {
      "op": "apply_action",
      "player": 1,
      "action": {
        "type": "play_face_up",
        "card_id": "p1c1"
      }
    },
    {
      "op": "assert_state",
      "expect": {
        "next_player": 0,
        "completed_rounds": [
          {
            "leader": 0,
            "winner": 0
          }
        ],
        "current_round": {
          "leader": 0,
          "plays": []
        }
      }
    }
  ]
}
