{
  "fixture_version": "engine-fixture/v1",
  "id": "raises/accepted-reraise-over-played-card-keeps-response-turn",
  "ruleset": "truco-2p-v1",
  "description": "When a villain raise over a hero play is re-raised and accepted, the unresolved table response still belongs to the villain after export and reload.",
  "initial_state": {
    "dealer": 1,
    "next_player": 0,
    "score": {
      "0": 0,
      "1": 0
    },
    "hand_value": 1,
    "turnup": {
      "rank": "A",
      "suit": "SPADES"
    },
    "hands": {
      "0": [
        {
          "id": "p0c0",
          "rank": "7",
          "suit": "DIAMONDS"
        },
        {
          "id": "p0c1",
          "rank": "6",
          "suit": "CLUBS"
        },
        {
          "id": "p0c2",
          "rank": "4",
          "suit": "HEARTS"
        }
      ],
      "1": [
        {
          "id": "p1c0",
          "rank": "3",
          "suit": "CLUBS"
        },
        {
          "id": "p1c1",
          "rank": "5",
          "suit": "SPADES"
        },
        {
          "id": "p1c2",
          "rank": "4",
          "suit": "DIAMONDS"
        }
      ]
    },
    "completed_rounds": [],
    "current_round": {
      "leader": 0,
      "plays": []
    },
    "pending_raise": null
  },
  "steps": [
    {
      "op": "apply_action",
      "player": 0,
      "action": {
        "type": "play_face_up",
        "card_id": "p0c0"
      }
    },
    {
      "op": "apply_action",
      "player": 1,
      "action": {
        "type": "raise",
        "to": 3
      }
    },
    {
      "op": "apply_action",
      "player": 0,
      "action": {
        "type": "raise",
        "to": 6
      }
    },
    {
      "op": "apply_action",
      "player": 1,
      "action": {
        "type": "accept_raise"
      }
    },
    {
      "op": "assert_export_round_trip",
      "expect": {
        "next_player": 1,
        "hand_value": 6,
        "pending_raise": null,
        "completed_rounds": [],
        "current_round": {
          "leader": 0,
          "plays": [
            {
              "player": 0,
              "visibility": "up",
              "card": {
                "rank": "7",
                "suit": "DIAMONDS"
              }
            }
          ]
        }
      }
    }
  ]
}
