{
  "fixture_version": "engine-fixture/v1",
  "id": "hidden-cards/hidden-vs-hidden-round-ties",
  "ruleset": "truco-2p-v1",
  "description": "Two hidden cards in the same round produce a tie.",
  "initial_state": {
    "dealer": 1,
    "next_player": 0,
    "score": {
      "0": 0,
      "1": 0
    },
    "hand_value": 1,
    "turnup": {
      "rank": "7",
      "suit": "SPADES"
    },
    "hands": {
      "0": [
        {
          "id": "p0c0",
          "rank": "K",
          "suit": "HEARTS"
        },
        {
          "id": "p0c1",
          "rank": "6",
          "suit": "CLUBS"
        }
      ],
      "1": [
        {
          "id": "p1c0",
          "rank": "4",
          "suit": "DIAMONDS"
        },
        {
          "id": "p1c1",
          "rank": "5",
          "suit": "SPADES"
        }
      ]
    },
    "completed_rounds": [
      {
        "leader": 0,
        "winner": 0
      }
    ],
    "current_round": {
      "leader": 0,
      "plays": []
    },
    "pending_raise": null
  },
  "steps": [
    {
      "op": "assert_legal_actions",
      "player": 0,
      "must_include": [
        {
          "type": "play_face_down",
          "card_id": "p0c0"
        },
        {
          "type": "play_face_up",
          "card_id": "p0c0"
        }
      ]
    },
    {
      "op": "apply_action",
      "player": 0,
      "action": {
        "type": "play_face_down",
        "card_id": "p0c0"
      }
    },
    {
      "op": "apply_action",
      "player": 1,
      "action": {
        "type": "play_face_down",
        "card_id": "p1c0"
      }
    },
    {
      "op": "assert_state",
      "expect": {
        "next_player": null,
        "hand_value": 1,
        "hand_winner": 0,
        "match_winner": null,
        "score": {
          "0": 1,
          "1": 0
        },
        "completed_rounds": [
          {
            "leader": 0,
            "winner": 0
          },
          {
            "leader": 0,
            "winner": null
          }
        ],
        "current_round": {
          "leader": 0,
          "plays": []
        },
        "pending_raise": null
      }
    }
  ]
}
