{
  "fixture_version": "engine-fixture/v1",
  "id": "raises/opening-raise-accepted",
  "ruleset": "truco-2p-v1",
  "description": "An opening raise from 1 to 3 can be accepted and the hand continues at 3.",
  "initial_state": {
    "dealer": 1,
    "next_player": 0,
    "score": {
      "0": 0,
      "1": 0
    },
    "hand_value": 1,
    "turnup": {
      "rank": "A",
      "suit": "SPADES"
    },
    "hands": {
      "0": [
        {
          "id": "p0c0",
          "rank": "7",
          "suit": "DIAMONDS"
        },
        {
          "id": "p0c1",
          "rank": "6",
          "suit": "CLUBS"
        },
        {
          "id": "p0c2",
          "rank": "4",
          "suit": "HEARTS"
        }
      ],
      "1": [
        {
          "id": "p1c0",
          "rank": "7",
          "suit": "CLUBS"
        },
        {
          "id": "p1c1",
          "rank": "5",
          "suit": "SPADES"
        },
        {
          "id": "p1c2",
          "rank": "4",
          "suit": "DIAMONDS"
        }
      ]
    },
    "completed_rounds": [],
    "current_round": {
      "leader": 0,
      "plays": []
    },
    "pending_raise": null
  },
  "steps": [
    {
      "op": "apply_action",
      "player": 0,
      "action": {
        "type": "raise",
        "to": 3
      }
    },
    {
      "op": "assert_state",
      "expect": {
        "next_player": 1,
        "hand_value": 1,
        "pending_raise": {
          "raised_by": 0,
          "to": 3,
          "previous_value": 1
        }
      }
    },
    {
      "op": "apply_action",
      "player": 1,
      "action": {
        "type": "accept_raise"
      }
    },
    {
      "op": "assert_state",
      "expect": {
        "next_player": 0,
        "hand_value": 3,
        "pending_raise": null,
        "completed_rounds": []
      }
    }
  ]
}
