{
  "fixture_version": "engine-fixture/v1",
  "id": "score-and-match-flow/accepted-raise-split-round-third-trick-round-trips",
  "ruleset": "truco-2p-v1",
  "description": "A hand at stake 3 with split first two rounds must survive export and reload before and after the deciding third trick.",
  "initial_state": {
    "dealer": 1,
    "next_player": 0,
    "score": {
      "0": 0,
      "1": 0
    },
    "hand_value": 3,
    "turnup": {
      "rank": "5",
      "suit": "CLUBS"
    },
    "hands": {
      "0": [
        {
          "id": "p0c1",
          "rank": "7",
          "suit": "CLUBS"
        }
      ],
      "1": [
        {
          "id": "p1c2",
          "rank": "6",
          "suit": "SPADES"
        }
      ]
    },
    "completed_rounds": [
      {
        "leader": 0,
        "winner": 1
      },
      {
        "leader": 1,
        "winner": 0
      }
    ],
    "current_round": {
      "leader": 0,
      "plays": []
    },
    "last_raised_by": 0,
    "pending_raise": null,
    "pending_decision": null
  },
  "steps": [
    {
      "op": "assert_export_round_trip",
      "expect": {
        "next_player": 0,
        "hand_value": 3,
        "hand_winner": null,
        "score": {
          "0": 0,
          "1": 0
        },
        "completed_rounds": [
          {
            "leader": 0,
            "winner": 1
          },
          {
            "leader": 1,
            "winner": 0
          }
        ],
        "current_round": {
          "leader": 0,
          "plays": []
        }
      }
    },
    {
      "op": "apply_action",
      "player": 0,
      "action": {
        "type": "play_face_up",
        "card_id": "p0c1"
      }
    },
    {
      "op": "apply_action",
      "player": 1,
      "action": {
        "type": "play_face_up",
        "card_id": "p1c2"
      }
    },
    {
      "op": "assert_export_round_trip",
      "expect": {
        "next_player": null,
        "hand_value": 3,
        "hand_winner": 1,
        "score": {
          "0": 0,
          "1": 3
        },
        "completed_rounds": [
          {
            "leader": 0,
            "winner": 1
          },
          {
            "leader": 1,
            "winner": 0
          },
          {
            "leader": 0,
            "winner": 1
          }
        ],
        "current_round": {
          "leader": 1,
          "plays": []
        },
        "pending_raise": null
      }
    }
  ]
}
